{
  "$schema": "http://json-schema.org/draft-07/schema#",
  "title": "Visual",
  "description": "viz/<slug>/visual.json: one visual's catalogue entry and how its checks run. The folder name is the slug, the page is index.html, and every path is relative to the folder unless it says otherwise. A visual without site_page needs webmcp_tools and index.html; a visual with site_page has neither, unless it is sealed (scripts/build_catalogue.py checks both).",
  "type": "object",
  "required": ["title", "summary", "source_url", "fetched", "data", "tags", "category"],
  "additionalProperties": false,
  "properties": {
    "title": { "type": "string", "minLength": 1 },
    "summary": { "type": "string", "minLength": 1 },
    "source_url": { "type": "string", "minLength": 1 },
    "fetched": { "type": "string", "pattern": "^[0-9]{4}-[0-9]{2}-[0-9]{2}$" },
    "data": {
      "type": "string",
      "description": "The data file published beside the page as data.json.",
      "pattern": "^(?!/)(?!.*\\.\\.)[^/].*\\.(?:csv|json)$"
    },
    "webmcp_tools": {
      "type": "array",
      "minItems": 3,
      "items": { "type": "string", "pattern": "^\\w+$" },
      "uniqueItems": true
    },
    "tags": {
      "type": "array",
      "minItems": 1,
      "items": { "type": "string", "pattern": "^[a-z0-9]+(?:-[a-z0-9]+)*$" },
      "uniqueItems": true
    },
    "category": { "type": "string", "minLength": 1 },
    "assets": {
      "type": "array",
      "minItems": 1,
      "description": "Further files of the folder published beside index.html at the same relative path.",
      "items": { "type": "string", "pattern": "^(?!/)(?!.*\\.\\.).+$" },
      "uniqueItems": true
    },
    "downloads": {
      "type": "string",
      "description": "A JSON file whose downloads list (path, https url, sha256, bytes) pins files too large for Git; the site fetches and publishes them.",
      "pattern": "^(?!/)(?!.*\\.\\.).+\\.json$"
    },
    "site_page": {
      "type": "string",
      "description": "The page of yujieteo/site that replaced this visual's page, as a path under teoyujie.org, such as play/beamdiag/. The folder then keeps only the data, the fixtures and the builders that the site pins in its visuals.lock: it has no index.html and no WebMCP tools, and the catalogue, the page rules and the browser checks leave it out. A sealed visual (sealed) keeps its index.html and its tools: the site embeds that page.",
      "pattern": "^[a-z0-9]+(?:-[a-z0-9]+)*/[a-z0-9]+(?:-[a-z0-9]+)*/$"
    },
    "sealed": {
      "type": "boolean",
      "description": "true for a sealed artifact: index.html is built by the folder's Rust crate, a member of the Cargo workspace at the root, compiled to WebAssembly and sealed with look/ (the site's theme, fonts and header) into one file that Git keeps. With site_page, yujieteo/site embeds the page in its own page and pins its bytes in visuals.lock, so the folder keeps index.html and its webmcp_tools. Its checks rebuild the page and compare it, the page rules check only its requests, because look/ pins the site's look and tests it, and the crate with look/ stays within 25,000 lines (scripts/rules.py)."
    },
    "published": {
      "type": "boolean",
      "description": "false for a visual the site does not publish; published when absent."
    },
    "uses": {
      "type": "array",
      "minItems": 1,
      "description": "Shared files or folders outside viz/, relative to the repository root, that this visual depends on: a change to one runs the checks of every visual that lists it instead of every visual.",
      "items": { "type": "string", "pattern": "^(?!/)(?!viz/)(?!.*\\.\\.).+$" },
      "uniqueItems": true
    },
    "checks": {
      "type": "array",
      "minItems": 1,
      "description": "Shell commands run from the folder in place of the default checks (build.py --verify, node --test and unittest over tests/).",
      "items": { "type": "string", "minLength": 1 }
    },
    "allow": {
      "type": "object",
      "additionalProperties": false,
      "description": "Findings of a deterministic check that the visual keeps on purpose, each as the check prints it after the visual's name but without the line number after the file name, so an edit elsewhere in the file does not break it; scripts/rules.py and scripts/deadcode.mjs say what each check reports. Each entry allows one finding: list it twice to allow two identical findings. An entry that matches no finding fails the check, so the list cannot go stale.",
      "properties": {
        "deadcode": { "type": "array", "minItems": 1, "items": { "type": "string", "minLength": 1 } },
        "python": { "type": "array", "minItems": 1, "items": { "type": "string", "minLength": 1 } },
        "contrast": { "type": "array", "minItems": 1, "items": { "type": "string", "minLength": 1 } },
        "requests": { "type": "array", "minItems": 1, "items": { "type": "string", "minLength": 1 } },
        "theme": { "type": "array", "minItems": 1, "items": { "type": "string", "minLength": 1 } },
        "sourcetests": { "type": "array", "minItems": 1, "items": { "type": "string", "minLength": 1 } }
      }
    },
    "typecheck": {
      "type": "object",
      "additionalProperties": false,
      "description": "How scripts/typecheck.mjs extracts the page's inline scripts for the folder's tsconfig.json.",
      "properties": {
        "page": {
          "type": "string",
          "description": "The HTML whose inline scripts are extracted, when not index.html: a page with another name, or a builder's template whose inlined src/ files tsc checks directly.",
          "pattern": "^(?!/)(?!.*\\.\\.).+\\.html$"
        },
        "skip": {
          "type": "array",
          "description": "Inline script blocks left out: an id, or a folder file (an entry ending in .js) whose inlined copy is left out, such as the beamdswitch template.",
          "items": { "type": "string", "minLength": 1 },
          "uniqueItems": true
        }
      }
    }
  }
}
