{
  "title": "How much of the early FPL points are repeatable?",
  "summary": "Several of the top FPL scorers after Gameweek 5 of 2026/27 are running well above their expected goal involvement, so their points are the least likely to repeat.",
  "source_url": "https://fantasy.premierleague.com/api/bootstrap-static/",
  "fetched": "2026-09-28",
  "data": "raw.json",
  "webmcp_tools": [
    "get_data",
    "get_metadata",
    "query"
  ],
  "tags": [
    "fpl",
    "football",
    "statistics",
    "strategy"
  ],
  "category": "data visualization"
}
