{
  "title": "Convexity Action Engine",
  "summary": "Press Ctrl/⌘ K, type what you are considering, and see it in your Singapore context: screened for ruin first, then compared on reliable upside, right-tail upside, timing and opportunity cost against real alternatives. 1,374 everyday actions and 26 to avoid; how common each is comes from American Time Use Survey microdata, and every judged number is labelled as such. Save the page in your context as a narrated beamdswitch deck.",
  "source_url": "https://github.com/yujieteo/visuals/tree/main/viz/convexity-action-engine",
  "fetched": "2026-09-29",
  "data": "raw.json",
  "webmcp_tools": [
    "get_metadata",
    "search_actions",
    "get_action",
    "compare_actions"
  ],
  "tags": [
    "decision-making",
    "convexity",
    "optionality",
    "tail-risk",
    "singapore"
  ],
  "category": "data visualization",
  "checks": [
    "node --test 'tests/*.test.mjs'",
    "python3 -m unittest discover -s tests -p 'test_*.py'"
  ]
}
