{
  "title": "Marvell cash conversion",
  "summary": "Marvell’s revenue rebounded in fiscal 2026, while operating cash flow remained a smaller share of sales than at the prior peak.",
  "source_url": "https://data.sec.gov/api/xbrl/companyfacts/CIK0001835632.json",
  "fetched": "2026-09-28",
  "data": "raw.json",
  "webmcp_tools": [
    "get_data",
    "get_metadata",
    "query"
  ],
  "tags": [
    "stocks",
    "semiconductors",
    "fundamentals",
    "cash-flow",
    "finance"
  ],
  "category": "data visualization",
  "uses": [
    "scripts/stock_cases.py",
    "scripts/templates/stock-cases-report.js"
  ]
}
