{
  "title": "What Manchester City’s charges and accounts do and do not show",
  "summary": "An evidence-first timeline separates the Premier League allegations, the distinct 2020 CAS UEFA case, and the latest filed accounts.",
  "source_url": "https://www.premierleague.com/en/news/3045970",
  "fetched": "2026-09-28",
  "data": "raw.csv",
  "webmcp_tools": [
    "get_data",
    "get_metadata",
    "query"
  ],
  "tags": [
    "football",
    "finance",
    "premier-league",
    "manchester-city"
  ],
  "category": "data visualization"
}
