{
  "title": "Connection rises as appetite to shape the future falls",
  "summary": "Older Singapore residents report stronger connection to the country but less interest in shaping its future, widening the gap from 0.09 to 1.07 points.",
  "source_url": "https://data.gov.sg/datasets/d_05fffefe9045d234eb140d7db0acdeb9/view",
  "fetched": "2026-09-27",
  "data": "raw.csv",
  "webmcp_tools": [
    "get_data",
    "get_metadata",
    "query"
  ],
  "tags": [
    "social-values",
    "age",
    "belonging",
    "civic-participation",
    "singapore"
  ],
  "category": "data visualization"
}
