{
  "title": "The computing salary premium widened",
  "summary": "Computing-titled degrees moved from 0.6% below the yearly median salary in 2013 to 36.4% above it in 2024.",
  "source_url": "Singapore Graduate Employment Survey (provided dataset)",
  "fetched": "2026-09-27",
  "data": "raw.csv",
  "webmcp_tools": [
    "get_data",
    "get_metadata",
    "query"
  ],
  "tags": [
    "graduate-employment",
    "salary",
    "computing",
    "singapore",
    "universities"
  ],
  "category": "data visualization"
}
