{
  "title": "Singapore haze, region by region",
  "summary": "Hourly PSI and PM2.5 for Singapore’s five regions from 1 April 2026 to 29 September 2026: no PSI above 100 until 4 September, then 15 Unhealthy days and a peak of 155 in Central.",
  "source_url": "https://api-open.data.gov.sg/v2/real-time/api/psi",
  "fetched": "2026-09-29",
  "data": "raw.json",
  "webmcp_tools": [
    "get_data",
    "get_metadata",
    "query"
  ],
  "tags": [
    "haze",
    "singapore",
    "air-quality",
    "psi",
    "pm25"
  ],
  "category": "data visualization",
  "allow": {
    "deadcode": [
      "index.html: 's' is declared but its value is never read."
    ]
  }
}
