{
  "title": "Diagonal Tension: Skin, Stringers and Doubler",
  "summary": "At the same applied shear load, what changes when a doubler is added to an aluminium skin-and-stringer panel? A one-file finite-element model meshes the panel with plane-stress quadrilaterals, stringers as axial bars and the doubler as a local membrane thickness, solves both variants by sparse conjugate gradient in a Web Worker, and compares mass, compliance, probe displacements and stresses, principal tension by region and stringer forces, with A and B maps on one colour scale. Linear elastic and pre-buckling, with a self-check, JSON, CSV and a narrated Markdown deck to open in beamdswitch. Runs offline.",
  "source_url": "https://github.com/yujieteo/visuals/tree/main/viz/diagonal-tension",
  "fetched": "2026-10-02",
  "data": "raw.json",
  "webmcp_tools": [
    "get_metadata",
    "get_current_state",
    "run_comparison",
    "run_self_tests"
  ],
  "tags": [
    "structural-engineering",
    "finite-element-method",
    "engineering",
    "computational"
  ],
  "category": "data visualization",
  "typecheck": {
    "page": "diagonal-tension.html",
    "skip": [
      "dt-beamdswitch"
    ]
  },
  "allow": {
    "deadcode": [
      "index.html: 'B' is declared but its value is never read."
    ]
  }
}
