{
  "title": "OKR Setter",
  "summary": "Set objectives and key results, see progress per key result and objective, and check each against plain rules for a good OKR.",
  "source_url": "https://github.com/yujieteo/visuals/tree/main/viz/okr-setter",
  "fetched": "2026-10-05",
  "data": "raw.json",
  "webmcp_tools": [
    "get_metadata",
    "get_state",
    "get_markdown",
    "get_example",
    "get_toon"
  ],
  "tags": [
    "okr",
    "planning",
    "goals",
    "toon"
  ],
  "category": "planning",
  "uses": [
    "scripts/kit",
    "scripts/templates/beamdswitch",
    "scripts/templates/beamdswitch.js",
    "scripts/visual_build.py",
    "scripts/visual_kit.py"
  ],
  "typecheck": {
    "skip": [
      "kit",
      "beamdswitch",
      "model",
      "report",
      "view"
    ]
  }
}
