{
  "title": "Visual skeleton: the generator's example",
  "summary": "The page scripts/new_visual.py writes for a new visual, with MathJax: a damped oscillator whose state lives in the URL, saves and loads as JSON, and exports a Markdown record and a narrated beamdswitch deck. Works offline.",
  "source_url": "https://github.com/yujieteo/visuals/tree/main/viz/visual-skeleton",
  "fetched": "2026-10-04",
  "data": "raw.json",
  "webmcp_tools": [
    "get_metadata",
    "get_state",
    "get_markdown",
    "get_example"
  ],
  "tags": [
    "tools",
    "interactive"
  ],
  "category": "data visualization",
  "published": false,
  "uses": [
    "scripts/kit",
    "scripts/templates/beamdswitch",
    "scripts/templates/beamdswitch.js",
    "scripts/visual_build.py",
    "scripts/visual_kit.py",
    "scripts/vendor/mathjax"
  ],
  "typecheck": {
    "skip": [
      "kit",
      "beamdswitch",
      "model",
      "report",
      "view"
    ]
  },
  "allow": {
    "requests": [
      "index.html calls new Worker(a): a computed URL the rule cannot check, so use a literal path"
    ]
  }
}
