{
  "title": "Palo Alto Networks cash conversion",
  "summary": "Palo Alto Networks’ cash generation has stayed above 39% of revenue as its security platform scales.",
  "source_url": "https://data.sec.gov/api/xbrl/companyfacts/CIK0001327567.json",
  "fetched": "2026-09-28",
  "data": "raw.json",
  "webmcp_tools": [
    "get_data",
    "get_metadata",
    "query"
  ],
  "tags": [
    "stocks",
    "cybersecurity",
    "fundamentals",
    "cash-flow",
    "finance"
  ],
  "category": "data visualization",
  "uses": [
    "scripts/stock_cases.py",
    "scripts/templates/stock-cases-report.js"
  ]
}
