{
  "title": "Work lanyards in Singapore",
  "summary": "Work and ID-card lanyards buyable in Singapore, from a dated snapshot of Amazon.sg's public listings: a gallery of their designs with price, deal, rating, review count and paraphrased review themes, sortable by price, rating, reviews or best value and filterable by feature, each with a Buy link to the shop.",
  "source_url": "https://www.amazon.sg/s?k=lanyard+id+card+holder",
  "fetched": "2026-10-03",
  "data": "data.json",
  "webmcp_tools": [
    "get_metadata",
    "list_lanyards",
    "get_lanyard"
  ],
  "tags": [
    "singapore",
    "shopping",
    "tools"
  ],
  "category": "data visualization"
}
