{
  "title": "Multi-armed Bandit: Thompson Sampling and UCB",
  "summary": "Choose the next trial among variants with uncertain success rates: Thompson Sampling and UCB1 recommendations from your own success/failure counts, a seeded simulation of how they explore, and a mode that splits next week's hours among activities from how worthwhile their past hour-blocks felt.",
  "source_url": "https://arxiv.org/abs/1707.02038",
  "fetched": "2026-10-01",
  "data": "raw.json",
  "webmcp_tools": [
    "get_data",
    "get_metadata",
    "query"
  ],
  "tags": [
    "decision-making",
    "experimentation",
    "probability",
    "statistics"
  ],
  "category": "data visualization",
  "typecheck": {
    "skip": ["mab-logic", "beamdswitch", "report", "mab-ui"]
  }
}
