{
  "title": "Lug and pin joint calculator",
  "summary": "Preliminary static sizing of a double-shear lug and pin joint, one male lug between two female clevis legs on a solid pin, under axial, transverse or oblique ultimate load. Every failure mode of AFFDL Stress Analysis Manual chapter 9 (lug bearing and net section, bushing, the 1.6-power oblique interaction, pin shear, pin bending with the load-shift refinement, and tangs) gets its allowable, ultimate and yield safety factors and margins, with a calculation trace by equation number, an interaction diagram and an angle sweep. Units switch per quantity, inputs save as JSON or a link, the joint saves as a narrated Markdown deck to open in beamdswitch for slides and a video, and the page checks itself against the chapter's worked example on every load.",
  "source_url": "https://github.com/yujieteo/visuals/tree/main/viz/lug-joint",
  "fetched": "2026-09-30",
  "data": "raw.json",
  "webmcp_tools": [
    "get_metadata",
    "get_current_joint",
    "solve_joint",
    "run_self_tests"
  ],
  "tags": [
    "structural-engineering"
  ],
  "category": "data visualization",
  "checks": [
    "node --test 'tests/*.test.{mjs,cjs}'",
    "python3 -m unittest discover -s tests -p 'test_*.py'"
  ],
  "allow": {
    "deadcode": [
      "index.html: 'pin' is declared but its value is never read.",
      "engine.js: 'pin' is declared but its value is never read."
    ]
  }
}
