{
  "title": "Your energy dips mid-afternoon. Your inbox doesn't.",
  "summary": "A workday timeline pairs the circadian post-lunch dip with the measured reflex of email: 70% answered within 6 seconds, 64 seconds to refocus each time, and less stress when checks drop to three a day.",
  "source_url": "https://www.interruptions.net/literature/Jackson-JOSIT-01.pdf",
  "fetched": "2026-09-29",
  "data": "raw.json",
  "webmcp_tools": [
    "get_data",
    "get_metadata",
    "query"
  ],
  "tags": [
    "productivity",
    "email",
    "focus",
    "circadian-rhythm"
  ],
  "category": "data visualization"
}
