{
  "title": "Python Notebook",
  "summary": "Python notebooks that run in the browser, with numpy, pandas, Matplotlib, seaborn, SciPy, SymPy, scikit-learn, Pillow, openpyxl, pyarrow and statsmodels. Code cells, Markdown with mathematics, input(), Stop and Restart, data files, .ipynb import and export, and saved work in this browser. Save HTML copy makes one file with Python, the packages, the notebook and its data, which runs offline from file:// in Chrome and Firefox. No code or data leaves the device. Pyodide 314.0.5 and PyScript 0.7.31, pinned.",
  "source_url": "https://pyodide.org/",
  "fetched": "2026-10-04",
  "data": "raw.json",
  "downloads": "downloads.json",
  "assets": [
    "sw.js"
  ],
  "uses": [
    "scripts/kit/style-tokens.css",
    "scripts/style_guide.py"
  ],
  "webmcp_tools": [
    "get_notebook",
    "get_runtime",
    "list_files",
    "list_notebooks"
  ],
  "tags": [
    "python",
    "notebook",
    "data-science",
    "offline"
  ],
  "category": "interactive model",
  "allow": {
    "requests": [
      "index.html uses EventSource: a page makes no request outside its folder, and reads its own files with fetch",
      "index.html uses WebSocket: a page makes no request outside its folder, and reads its own files with fetch",
      "index.html uses XMLHttpRequest: a page makes no request outside its folder, and reads its own files with fetch",
      "index.html calls fetch(c): a computed URL the rule cannot check, so use a literal path",
      "index.html calls fetch(e): a computed URL the rule cannot check, so use a literal path",
      "index.html calls fetch(e.src): a computed URL the rule cannot check, so use a literal path",
      "index.html calls fetch(file.path): a computed URL the rule cannot check, so use a literal path",
      "index.html calls fetch(g): a computed URL the rule cannot check, so use a literal path",
      "index.html calls fetch(s): a computed URL the rule cannot check, so use a literal path",
      "index.html calls fetch(t): a computed URL the rule cannot check, so use a literal path",
      "index.html calls fetch(url): a computed URL the rule cannot check, so use a literal path",
      "index.html calls import(${e}${new URL(r): a computed URL the rule cannot check, so use a literal path",
      "index.html calls import(P.moduleURL(\"pyodide.asm.mjs\"): a computed URL the rule cannot check, so use a literal path",
      "index.html calls import(P.moduleURL(\"pyodide.mjs\"): a computed URL the rule cannot check, so use a literal path",
      "index.html calls import(a): a computed URL the rule cannot check, so use a literal path",
      "index.html calls import(e): a computed URL the rule cannot check, so use a literal path",
      "index.html calls import(l): a computed URL the rule cannot check, so use a literal path",
      "index.html calls import(m): a computed URL the rule cannot check, so use a literal path",
      "index.html calls import(n): a computed URL the rule cannot check, so use a literal path",
      "index.html calls import(new URL(d): a computed URL the rule cannot check, so use a literal path",
      "index.html calls import(o): a computed URL the rule cannot check, so use a literal path",
      "index.html calls import(t): a computed URL the rule cannot check, so use a literal path",
      "index.html calls import(url): a computed URL the rule cannot check, so use a literal path",
      "index.html calls new Worker(n): a computed URL the rule cannot check, so use a literal path",
      "index.html calls new Worker(sh): a computed URL the rule cannot check, so use a literal path"
    ],
    "theme": [
      "index.html site-theme script is not style_guide.THEME_SCRIPT unchanged"
    ]
  }
}
