{
  "title": "Root locus design check",
  "summary": "Type a compensator C, plant G and feedback path H in a small Python syntax and see the s-plane or z-plane root locus for K ≥ 0, with ZOH, Tustin or matched discretisation of G and a Padé or whole-sample delay. Pick K on a log slider or by clicking the locus, read the closed-loop poles, critical gain, breakaway points and asymptotes, and check the poles against damping, natural-frequency and settling-time requirements, which returns the passing K intervals or the binding requirement. Cancellations, improper loops and coarse sampling are flagged, the record exports and re-imports as Markdown, the check saves as a narrated Markdown deck to open in beamdswitch for slides and a video, and built-in self-tests reproduce textbook cases.",
  "source_url": "https://github.com/yujieteo/visuals/tree/main/viz/root-locus",
  "fetched": "2026-09-30",
  "data": "raw.json",
  "webmcp_tools": [
    "get_metadata",
    "get_current_check",
    "analyze_loop",
    "export_markdown",
    "run_self_tests"
  ],
  "tags": [
    "control-theory",
    "engineering",
    "computational"
  ],
  "category": "data visualization",
  "typecheck": {
    "skip": [
      "beamdswitch.js"
    ]
  }
}
