{
  "title": "Generating Functions Lab",
  "summary": "Generating functions as a calculus for discrete structures: pick a problem, see its objects, encode them as coefficients, manipulate the series, read a coefficient back and watch an independent enumeration agree. Thirty-four levels run from the geometric series, shifts and Fibonacci through convolution, coin change, compositions, Catalan, Lagrange inversion, EGFs and the exponential formula, partitions and singularity analysis, to roots-of-unity filters, the DFT as evaluation at roots of unity, the inverse DFT as coefficient extraction and the cyclic convolution theorem. Explore, Guided, Problems (a 22-step ladder with hints), Compare and Transform modes, a Fourier lab with the exact N = 4 example and the character table, a finite-vector sandbox, exact integer, rational and cyclotomic arithmetic, a command palette, deep links, an in-page presentation and beamdswitch Markdown export. Runs offline.",
  "source_url": "https://github.com/yujieteo/visuals/tree/main/viz/generating-functions",
  "fetched": "2026-10-01",
  "data": "raw.json",
  "webmcp_tools": [
    "get_metadata",
    "get_current_view",
    "extract_coefficient",
    "dft",
    "run_self_tests"
  ],
  "tags": [
    "combinatorics",
    "computational",
    "probability",
    "signal-processing"
  ],
  "category": "data visualization",
  "checks": [
    "node --test 'tests/*.test.{mjs,cjs}'",
    "python3 -m unittest discover -s tests -p 'test_*.py'"
  ],
  "typecheck": {
    "skip": [
      "gf-engine",
      "gf-lessons",
      "gf-beamdswitch",
      "gf-ui"
    ]
  },
  "allow": {
    "deadcode": [
      "index.html: 'id' is declared but its value is never read."
    ],
    "contrast": [
      "light: .binbox outlines a control in --border, 1.51:1 on --bg, below 3.0:1; use --control",
      "dark: .binbox outlines a control in --border, 1.84:1 on --bg, below 3.0:1; use --control"
    ],
    "sourcetests": [
      "tests/generating-functions-page.test.mjs: test \"one self-contained file: no network, no external scripts or fonts, no TeX library, canonical URL\" only checks source text; run the code and assert on what it does",
      "tests/generating-functions-page.test.mjs: test \"without JavaScript the page still teaches: introduction, concept map, technique index, formulas, problems, the DFT link\" only checks source text; run the code and assert on what it does"
    ]
  }
}
